{
  "schema": 1,
  "id": "harness-scenario-evidence-bindings-v1",
  "date": "2026-08-09",
  "status": "current-governed-scenario-evidence-bindings-no-evidence-promotion",
  "coverageAuthority": {
    "path": "registry/human-ai-collaboration-current-candidate-capability-coverage-reconciliation-2026-08-01.json",
    "id": "human-ai-collaboration-current-candidate-capability-coverage-reconciliation-2026-08-01",
    "sha256": "d962097402f55c3bc878df0a6ce192ee35086eceef4ea97c4c8d258a971bdf65"
  },
  "bindings": [
    {"scenarioId": "GEN-CREATIVE-01", "sourcePath": "registry/human-ai-collaboration-creative-capability-baseline-2026-07-31.json", "bindingMode": "scenario-record", "identityPointers": ["/scenarioBinding/scenarioId"], "aggregateScenarioPointer": null, "expectedAggregateScenarioId": null, "scenarioIdentityPresentInSource": true, "bindingEvidenceCeiling": "source-record-identity-only-no-evidence-promotion", "explanation": "The source declares this scenario in its scenario binding."},
    {"scenarioId": "GEN-RESEARCH-01", "sourcePath": "registry/human-ai-collaboration-scenario-evidence-matrix-batch-01-2026-07-24.json", "bindingMode": "scenario-record", "identityPointers": ["/scenarios/1/id"], "aggregateScenarioPointer": null, "expectedAggregateScenarioId": null, "scenarioIdentityPresentInSource": true, "bindingEvidenceCeiling": "source-record-identity-only-no-evidence-promotion", "explanation": "The source matrix carries the named scenario record."},
    {"scenarioId": "GEN-LEARNING-01", "sourcePath": "registry/human-ai-collaboration-learning-capability-baseline-2026-07-31.json", "bindingMode": "scenario-record", "identityPointers": ["/scenarioBinding/scenarioId"], "aggregateScenarioPointer": null, "expectedAggregateScenarioId": null, "scenarioIdentityPresentInSource": true, "bindingEvidenceCeiling": "source-record-identity-only-no-evidence-promotion", "explanation": "The source declares this scenario in its scenario binding."},
    {"scenarioId": "GEN-ORG-DECISION-01", "sourcePath": "registry/human-ai-collaboration-org-decision-zero-model-protocol-2026-07-31.json", "bindingMode": "scenario-record", "identityPointers": ["/scenarioBinding/scenarioId"], "aggregateScenarioPointer": null, "expectedAggregateScenarioId": null, "scenarioIdentityPresentInSource": true, "bindingEvidenceCeiling": "source-record-identity-only-no-evidence-promotion", "explanation": "The source declares this scenario in its scenario binding."},
    {"scenarioId": "GEN-ACCESS-COMMS-01", "sourcePath": "registry/human-ai-collaboration-access-comms-capability-baseline-2026-07-31.json", "bindingMode": "scenario-record", "identityPointers": ["/scenarioBinding/scenarioId"], "aggregateScenarioPointer": null, "expectedAggregateScenarioId": null, "scenarioIdentityPresentInSource": true, "bindingEvidenceCeiling": "source-record-identity-only-no-evidence-promotion", "explanation": "The source declares this scenario in its scenario binding."},
    {"scenarioId": "SE-DISCOVERY-REQ-01", "sourcePath": "registry/other-cc-and-external-skill-scenario-coverage-audit-2026-07-27.json", "bindingMode": "scenario-record", "identityPointers": ["/behaviorallyObservedScenarioCells/0/scenarioId"], "aggregateScenarioPointer": null, "expectedAggregateScenarioId": null, "scenarioIdentityPresentInSource": true, "bindingEvidenceCeiling": "source-record-identity-only-no-evidence-promotion", "explanation": "The source audit carries the named observed scenario cell."},
    {"scenarioId": "SE-ARCH-DESIGN-01", "sourcePath": "registry/human-ai-collaboration-software-lifecycle-thin-slice-zero-model-calibration-evidence-2026-07-27.json", "bindingMode": "document-level-support", "identityPointers": [], "aggregateScenarioPointer": "/scenarioId", "expectedAggregateScenarioId": "SE-E2E-THIN-01", "scenarioIdentityPresentInSource": false, "bindingEvidenceCeiling": "document-level-support-no-independent-scenario-identity", "explanation": "The aggregate thin-slice record supports but does not identify this scenario."},
    {"scenarioId": "SE-IMPLEMENT-REVIEW-01", "sourcePath": "registry/other-cc-and-external-skill-scenario-coverage-audit-2026-07-27.json", "bindingMode": "scenario-record", "identityPointers": ["/behaviorallyObservedScenarioCells/1/scenarioId"], "aggregateScenarioPointer": null, "expectedAggregateScenarioId": null, "scenarioIdentityPresentInSource": true, "bindingEvidenceCeiling": "source-record-identity-only-no-evidence-promotion", "explanation": "The source audit carries the named observed scenario cell."},
    {"scenarioId": "SE-VERIFY-SECURE-01", "sourcePath": "registry/human-ai-collaboration-software-lifecycle-thin-slice-zero-model-calibration-evidence-2026-07-27.json", "bindingMode": "document-level-support", "identityPointers": [], "aggregateScenarioPointer": "/scenarioId", "expectedAggregateScenarioId": "SE-E2E-THIN-01", "scenarioIdentityPresentInSource": false, "bindingEvidenceCeiling": "document-level-support-no-independent-scenario-identity", "explanation": "The aggregate thin-slice record supports but does not identify this scenario."},
    {"scenarioId": "SE-RELEASE-CHANGE-01", "sourcePath": "registry/human-ai-collaboration-release-change-current-cc-codex-no-model-preflight-2026-07-30.json", "bindingMode": "scenario-record", "identityPointers": ["/scenarioId"], "aggregateScenarioPointer": null, "expectedAggregateScenarioId": null, "scenarioIdentityPresentInSource": true, "bindingEvidenceCeiling": "source-record-identity-only-no-evidence-promotion", "explanation": "The source declares this scenario at document level."},
    {"scenarioId": "SE-OPS-INCIDENT-01", "sourcePath": "registry/other-cc-and-external-skill-scenario-coverage-audit-2026-07-27.json", "bindingMode": "scenario-record", "identityPointers": ["/behaviorallyObservedScenarioCells/2/scenarioId", "/behaviorallyObservedScenarioCells/3/scenarioId"], "aggregateScenarioPointer": null, "expectedAggregateScenarioId": null, "scenarioIdentityPresentInSource": true, "bindingEvidenceCeiling": "source-record-identity-only-no-evidence-promotion", "explanation": "The source audit carries two observed records for this scenario."},
    {"scenarioId": "SE-MAINT-MIGRATE-01", "sourcePath": "registry/other-cc-and-external-skill-scenario-coverage-audit-2026-07-27.json", "bindingMode": "scenario-record", "identityPointers": ["/behaviorallyObservedScenarioCells/4/scenarioId"], "aggregateScenarioPointer": null, "expectedAggregateScenarioId": null, "scenarioIdentityPresentInSource": true, "bindingEvidenceCeiling": "source-record-identity-only-no-evidence-promotion", "explanation": "The source audit carries the named observed scenario cell."},
    {"scenarioId": "SE-MGMT-PRACTICE-01", "sourcePath": "registry/human-ai-collaboration-engineering-management-zero-model-protocol-2026-07-31.json", "bindingMode": "scenario-record", "identityPointers": ["/scenarioBinding/scenarioId"], "aggregateScenarioPointer": null, "expectedAggregateScenarioId": null, "scenarioIdentityPresentInSource": true, "bindingEvidenceCeiling": "source-record-identity-only-no-evidence-promotion", "explanation": "The source declares this scenario in its scenario binding."}
  ]
}
